year,sentence
1939,"March 1939 Hitler threw Hitler support leader Slovak Popular Party , Jozef Tiso , sought complete independence Slovakia  even great indication pact worthlessness Hitler break pact term Hitler sign GermanSoviet NonAggression Pact August 1939  KeystoneGetty Images , March 15 , 1939 , Hitler broke Hitler pledge respect remain Czechoslovakia occupy remainder state  March 1939 , Hitler secure whole Czec hoslovakia , prompt Britain , bad possible circumstance , extend guarantee PolandGermany next target already French allythat Britain would defend Britain attack  success ful military campaign 1939 1940 , Hitler recommend reduction arm production order not affect civilian morale  early year war , 1939 1940 , Hitler beneficiary outrageously good luck inept opponent  scuttle pocket battleship Graf Spee December 1939 Hitler displeasure loss furthe r reinforce inherent contradiction Raeder order strike boldly avoid damage navy ship  war begin Septembe r 1939 , Goerdeler become lead member conspiracy overthrow Hitler  secure eastern flank , August 1939 Hitler conclude nonaggression pact Soviet Union Molotov Ribbentrop Pact  Reichstag speec h January 1939 , Hitler make Hitler infamous threat international Jewry succeed start another world war , result would not result victory annihilation Jewish race Europe  Hitler saw event Hitler described Hitler speech January 30 , 1939 , come pas Jews start world war , Jews would perish  model mass murder come euthanasia program , order Hitler onSeptember 1 , 1939 , officially end August 1941 , strong protest German church  1939 Hitler prepared attack Poland , Leeb call active duty , take command Army Group C defend possible Allied attack west German army invade September 1 absorbed Poland  prominent writer exile include Thomas Mann whose Lotte Weimar , publish 1939 , offer subtle critique German militarism Hitler brother , Heinrich Mann  October 1939 , Manstein appoint chief staff Army Group Rundstedt west help develop alternative plan invasion France Sickle Cut , Sichelschnitt , Hitler adopt  conque st Poland 1939 , Hitler begin execute Hitler plan  October 1939 , Hitler appoint SS chief Heinrich Himmler take charge establish New Order Eastern Europe  Upset Western capitulation Munich , regard effort British French leader divert Hitler eastward , March 10 , 1939 , Stalin announce Soviet Union not intend pull anyone el chestnut fire  German invasion , origina lly set November 12 , 1939 , repeatedly postpone bitterly cold weather plea Hitler general additional time prepare  Unsentimental matter , August 1939 Stalin arrange nonaggression pact Germany allow Hitler invade Poland without fear war Soviets  Hitler approve Z Plan January 27 , 1939 , three month Hitler revoke BritishGerman Naval Agreement 1935 limited Hitler navy maximum 35 percent navy British counterpart move navy violation Versailles Treaty  Believing action meant Poland would not yield without war , April infuriate Hitler issue military directive Hitler arm force prepare arm force attack Poland anytime September 1 , 1939  , 270 night April 16 19 , 270 photograph , 269 purpose , 268 site , 270 statistic concern , 270 blitzkrieg , 270272 concept development , 270271 creation term , 270 definition military doctrine , 270 Fuhrung und Gefecht der verbundenen W affen Command Combat Combined Arms , 271 German Air Force , 271 German Army , 270271 Guderian , Heinz , 271 Hitler , Adolf , 271 Junkers Ju87 Stuk , 271 myth blitzkrieg , 272 panzer division , 272 photograph , 271 Poland Campaign 1939 , 271272 resupply line , 271272 Soviet Union invasion , 272 success , 272 tactical air power , 272 tank maintenance , 271 tank warfare , 271 , 272 term blitzkrieg , 270 , 272 Time magazine , 270 Truppenfuhrung Unit Command , 271 Udet , Ernst , 270Blobel , Paul , 193 , 194 Bloch , Claude Charles 18781967 , 272273 antitorpedo net , 273 combat action , 272 , 273 command , 272 date place birth , 272 death , 273 Hawaiian defense , 273 military education , 272 Pearl Harbor responsibility , 273 promotion , 272 , 273 retirement , 273 blockaderunning , 273274 Allied force , 273 date , 273 Italy , 273274 Japanese , 274 line communication , 273 number passenger lose , 273 number ship involve , 273 percentage blockaderunners lose , 273 submarine , 273274 YOUboats , loss , 273 Blomber g , Werner von 18781946 , 274 Blomber gFritsch Af fair , 275 commander chief German arm force , 274 date place birth , 274 death , 274 education , 274 Geneva disarmament talk , 274 Hitler , Adolf , , 274 Nurember g trial , 274 Rubber Lion , 274 SA Blood Pur ge , 274 Truppenamt , 274 W orld W ar , 274 Blomber gFritsch Af fair 1938 , 274275 Blomber g , Werner von , 275 Blomber g resignation , 275 Fritsch , W erner von , 275 Fritsch resignation , 275 Goring , Hermann , 275 Gruhn , Mar garethe , 275 Himmler , Heinrich , 275 Hitler , Adolf , 274 Keitel , W ilhelm , 274 result , 274 , 274 75 subordination Reichswehr German Army , 274Blue Division 19411943 , 275276 casualty , 275 commander , 275 consequence , 275 definition , 275 Franco , Francisco , 275 Grandes , Augustin Munoz , 275 Hitler , Adolf , , 275 motivation behind establishment , 275 name , 275 Blum , Lon 18721950 , 276 , 1562 arrest trial , 276 caretaker government , 276 date place birth , 276 death , 276 Dreyfus Af fair , 276 education , 276 imprisonment , 276 political career , 276 premier , 276 Blumentritt , Gunther 18921967 , 276277 date place birth , 276 date commission , 276 death , 277 General Staf f College , 277 military education , 276 overthrow Adolf Hitler , 277 postwar career , 277 rank , 277 W orld W ar , 276 World W ar II assignment , 277 Bock , Fedor von 18801945 , 277278 , 1206 , 1433 assassination Hitler , 278 Battle Minsk , 1139 combat action , 277 date place birth , 277 death , 278 family , 277 Hitler , Adolf , , 277 , 278 invasion Soviet Union , 277 invasion Poland , 277 photograph , 277 W orld W ar , 277 BODENPLA TTE , Operation January 1 , 1945 , 139 , 278279 analysis , 278 briefing , 278 description , 278 Galland , Adolf , 278intent plan , 278 number aircraft involve , 278 operational security , 278 Peltz , Dietrich , 278 reason , 278 Bodo , Norway Raid October 4 , 1943 , 279 code name , 279 force involve , 279 geographic location , 279 Hustvedt , Olaf M Aircraft Carriers , 586587 armament , 587 Essex CV 9 , 586 Essex CVA9 , 587 Essex CVS9 , 587 feature , 586 Intr epid orktown , 587 Korean W ar , 587 Lexington , 587 name , 587 number commission , 586 statistic , 587 W orld W ar II , 587 Esteva , JeanPierre 18801951 , 587588 admiral south , 587 appointment , 587 arrest , 588 combat action , 587 date place birth , 587 death , 588 imprisonment , 588 support V ichy government , 588 vacillation , 588 wound , 587 Estonia , 588589 Estonian Schutzstaf fel SS division , 589 German occupation , 588589 government , 588 independence , 588 , 589 influx Soviet citizen , 589 location , 589 loss population , 589 mutual assistance pact Soviet Union , 588 nonaggression pact , 588 population 1939 , 589 Soviet occupation , 588 euthanasia , Nazi program , 589590 adult euthanasia program , 589590 basis , 590 Bouhler , Philipp , 589 Brandt , Karl , 589 child euthanasia program , 589 definition , 589 Galen , Clemens August Graf von , , 590 Hitler , Adolf , 589 Law Prevention Progeny Hereditary Diseases , 589 number dead , 590Reich Committee Scientific Registration Serious Hereditarily Congenitally Based Illness , 589 secrecy , 589 , 590 sterilization program , 589 , 590 T4 , 589 Exercise TIGER , 1045 EXPOR TER , Operation , 1616Fair Employment Act , YOU.S  aircraft , tank , munition production , 680 arm industry , 681 blitzkrieg lightning war economic necessity , 679 consumer expenditure , 680 consumer good , 680 country bordering , 679 economic imbalance , 679 foreign worker , 681 FourYear Plan , 679 , 680 German war expenditure , 680 Goebbels , Joseph , 679 Himmler , Heinrich , 680 Hitler view , 681 Jews skilled labor , 681 labor shortage , 681 location , 679 major factor Speer success , 680 medium , control , 679 National Socialist justice , 679 NaziSoviet NonAggression Pact , 680 population 1939 , 679 production raw material , 680 raw material , shortage , 680size , 679 Speer , Albert , 680 territory resource , 680 woman work , 681 Germany , Air Force , 681684 Armaments Ministry , 683 aviation fuel , 683 clandestine air facility , 682 divebombing , 683 formation Luftwaf fe Junkers Ju87D Stuka divebombers , 682 image Goring , Hermann , 682 ground operation , 683 Hermann Goring Panzer Division , 683 Hitler , Adolf , , 682 Jeschonnek , Hans , 682 Junkers Ju87 Stuka divebomber , 683 Kondor Legion , 682 limitation , 683684 Luftflotten Air Fleets Luftwaf fe , 683 Messerschmitt Bf109 , 683 Messerschmitt Me262 , 683 Milch , Erhard , 682 Oberkommando der Luftwaf fe Air Force Supreme Command , OKL , 683 organizational weakness , 682 organization , 683 pilot loss , 683 Reich Air Ministry , 682 significance , 681 Udet , Ernst , 683 Versailles reaty , 681682 Germany , Army , 684687 army corp , 685 army group Heeresgruppe , 685 artillery division , 685 Auftragstaktik , 686 blitzkrieg doctrine , 684 command control , 686 common German soldier , 686 conscription , 684 corp , type , 685 echelon command , 685 elite unit , 686 field army , 685 fortress division , 685 German Air Force land division , 685 Grossdeutschland unit , 686 high command structure , 686 Hitler , Adolf , 686 horse cavalry division , 685InfantrieLehr Regiment , 686 infantry division , 684 internal external handicap , 686 main component , 684 mechanize unit , 684685 mountain division , 685 Oberkommando der W ehrmacht arm force high command , OKW , 686 Oberkommando de Heeres army high command , OKH , 686 operational level , 684 organization division , 684 Panzerarmee Grossdeutschland , 686 panzer corp , 685 panzer division , 685 Panzer grenadier division , 684 , 685 Panzer Lehr Division , 686 parachute division , 685 Reichsheer , 684 security division , 685 specialized division , 685 SS panzer division , 685 strategic level , 684 tactical level , 684 Volksgrenadier people grenadier division , 685 WaffenSchutzstaf fel W affenSS , 685 Germany , collapse MarchMay 1945 , 687689 Ardennes fensive Battle Bulge , 687 capitulation city , 687 description , 687 , 688 Donitz , Karl , 688 drive Rhine River , 687 German refugee , 688 Guderian , Heinz , 687 Hitler , Adolf , 687 , 688 map , 688 Operation TONE , 687 Soviet troop Berlin , 688 strength Allied force , 687 suicide Hitler , 688 surrender northern Italy , 688 Germany , Navy , 689691 Baltic , 691 battleship , 690 Bismar ck , loss , 690 Channel Dash , 690 Donitz , Karl , 690 , 691 Graf Spee , loss , 690 Hitler restriction naval operation , 690 Luftwaf fe support , 690Operation WESERBUNG , 690 Raeder , Erich , 690 , 691 rebuild , 689690 size begin war , 690 strategy attack British sealanes , 690 YOUboats , 690691 Germany , postwar occupation , 691693 Allied Control Council , 691 , 692 American occupation policy , 692 central planning economy , 692 denazification , 692 division Berlin zone , 692 feed population , 692 first Allied directive , 692 Holocaust , public disclosure , 692 merchant marine , 692 merger British American zone , 692 nation building , 691 Occupation Statute , term , 693 occupation zone , 691 occupy army , 691 population figure per occupation section , 692 prisoner war , 692 refugee , 692 selfgovernment YOU.S  , 730731 Civil W ar , 731 country bordering , 730 effect W orld W ar II , 730 famine disease loss , 730 Greek People Liberation Army , 731 Hitler invasion , 730 island , 730 Italian invasion Albania , 730 Jewish community Holocaust , 731 location , 730Metaxas , Ioannis , 730 National Liberation Front , 731 National Republican Greek League , 731 Papandreou , Geor ge , 731 population 1939 , 730 resistance group , 731 Greece , Air Force , 731732 aircraft , 731 Albanian front , 731 control , 731 Greek governmentinexile , 731 replacement part , 731 size , 731 squadron , 731 Greece , Army , 732 19401941 campaign , 732 casualty count , 732 commander , 732 Italian invasion Albania , 732 motorize division , 732 Number division , 732 number men , 732 political infighting , 732 Royal Hellenic Army , 732 Third Mountain Brigade , 732 Greece , Navy , 732733 component , 732 eastern Mediterranean , 732 handicap , 732 integration British Royal Navy , 732 late 1939 , 732 mutiny , 732 Greece Campaign , German April 630 , 1941 , 733735 commander , 733 consequence , 735 description , 733734 evacuation , 735 First Greek Army , 733 , 734 Force W British , 733 German aircraft attack Greek port Piraeus , 734 German invasion Greece Bulgaria , 733734 Koryzis , Alexandros , 735 loss , 735 map Greece Crete , 19401941 , 734 number great prisoner , 734 Operation DEMON , 735 precipitate event , 733 purpose , 7332nd Panzer Division , 734 Second Greek Army , 733 Greece Campaign , Italian October 28 , 1940March 1941 , 735737 Battle Cape Matapan , 737 British Commonwealth advance , 737 British fensive North Africa , 737 casualty count , 737 Cavallero , Ugo , 736 consequence Italian failure , 736 description , 736737 Greek resistance , 736 Hitler , Adolf , , 736 Italian retreat , 737 Italian ultimatum , 736 Mussolini , Benito , 735 , 736 , 737 Papagos , Alexandros , 736 precipitate event , 735736 strength force , 736 ViscontiPrasca , Sebastiano , 736 Greer , attack September 4 , 1941 , 738 armament , 738 description , 738 Roosevelt , Franklin D high commissioner Allied Council Austria , 937 Keyes , Roger John Brownlow 18721945 , 937938 appointment , 937 Boxer Uprising , 937 commander Dover Patrol , 938 commodore char ge submarine service , 937 Conservative member Parliament , 938 date place birth , 937 death , 938 director combine operation , 938 fall Prime Minister Neville Chamberlain , 938 liaison ficer King Leopold III Belgium , 938 peer , 938 promotion , 937 , 938 son , 938 Keynes , John Maynard , 712 Khalkhin Gol , Battle MaySeptember 1939 , 938939 casualty count , 939 command ficers , 938 consequence , 939 definition , 938 description , 938 outcome , 938939 precipitate event , 938 Khan , Noor Inayat , 1811 Kharkov , Battles 19411943 , 939941 casualty count , 940 command ficers , 939 , 940 Hitler , Adolf , , 940 Kharkov , importance , 939 Operation BARBAROSSA , 939 photograph , 940 Red Army Winter fensive , 939 Second Battle Kharkov , 939 significance , 940 Third Battle Kharkov , 939940 Kholm Pocket January 23 May 5 , 1942 , 941942 attempt relieve , 941 command ficers , 941description , 941 Hitler , Adolf , , 941 Kholm Shield award , 941 outcome , 941 significant Soviet attack , 941 Khozin , Mikhail Semenovich 18961979 , 942 Khrushchev , Nikita , 1630 Kiev Pocket , Battle August 21 September 26 , 1941 , 942943 commander , 942 consequence , 943 definition , 942 description , 943 precipitate event , 942 Stalin , Joseph , 943 Kikkawa Kiyoshi 19001943 , 943944 Battle Cape St"
1939,"late 1939 , Soviet leader Joseph Stalin concerned sharp increa se German power follow conquest Poland , Soviet leader Joseph Stalin sought acquire additional territory protect portion Soviet Union possible German attack Finland  Great Pur ge orchestrate Soviet leader Joseph Stalin exact frightful toll Soviet Navy leadership , consequence , Kuznetsov name people commissar navy min ister navy 1939 age 37  leader agree Soviet leader Joseph Stalin demand Soviet Union allow keep Polish territory take September 1939 effect , old Curzon Line establish Allied government peace settlement follow World War "
1939,"Following service General Marshall secretariat General Staff 1939 1941 , promote directly lieutenant colonel brigadier general February 24 , 1941 , assign command Infantry School  Marshall , become army chief staff September 1939 "
1939,"Roosevelt , aware multiple warrelief appeal might discourage donation , issue order midSeptember 1939 require warrelief organization secure certificat e registration Department State  begin World War II Europe September 1939 , Roosevelt increasingly turn Roosevelt attention foreign affair military preparedness , despite strong isolationist sentiment Congress among many American voter  World War II beganin September 1939 , Roosevelt organize neutrality patrol Western Atlantic , define October 1939 lie west line Saint Lawrence River rinidad  concern Roosevelt admin istration failure heighten outbreak war Europe September 1939 string Allied defeat follow  Roosevelt , August 2 , 1939 35  Roosevelt , Radio Address , September 3 , 1939 47  Roosevelt , Statement Finland , December 1 , 1939 56  President Roosevelt procl aim , 8 September 1939 , limited emer gency exist United States , term available strength , not even thirdrate military powe r , 363 , 364 codename , 362 combine bomber fense Germany , 362363 criticism , 363 De Gaulle , Charles , 364 invasion , 362 photograph , 363 priority win Battle Atlantic , 363 relation France , 363 Roosevelt , Franklin Delano , 362 , 363 topic discussion , 362 unconditional surrender announcement , 363 cashandcarry November 1939 , 364 definition , 364 Japan , 364 Neutrality Act 1937 , 364 opposition , 364 problem , 364 YOU.S  Roosevelt , August 2 , 1939 , 19931994 35  Roosevelt , Radio Address , September 3 , 1939 , 2009201 1 47  Roosevelt , Statement Finland , December 1 , 1939 , 2022 document 1940 , 20232067 56  Roosevelt , August 2 , 1939 , 19931994 doc  , 633 collaboration , 633 Daladier , Edouard , 631de Gaulle , Charles , 632 , 633 , 634 de Gaulle Free French force , 633 effect W orld W ar , 631 Fourth Republic , 633 French Communist Party , 631 French Expeditionary Corps , 633 French First Army , 633 French Maginot Line , 632 French Resistance , 632633 German invasion Rhineland , 631 German invasion Denmark Norway , 632 GermanSoviet NonAggression Pact , 631 Laval , Pierre , 633 liberation Paris , 633 location , 630 Maginot Line , 632 , 636 military strength , 631 myth fifth column , 631 Normandy , 633 occupation Ruhr , 631 overseas empire , 630 , 634 Ptain , Henri Philippe , 632 , 633 photograph V ictory Parade Paris , 633 Popular Front , 631 population 1939 , 630 rearmament , 631 Reynaud , Paul , 631632 Roosevelt , Franklin Delano , 633 seizure Sunderland , 631 Sitzkrieg Phony W ar , 631 , 632 size , 630 Vichy government , 632 Weygand , Maxime , 632 France , Air Force , 634635 aviation training program , 635 Battle France , 634 contribution Allied war ef fort , 635 development W orld W ar W orld W ar II , 634635 Dewoitine 520 , 635 performance 1940 , 634 Riom rial , 634 strength Armee de lAir , 635 supply pilot , 635 use defense France , 635 V ichy settlement , 635 waste resource , 635 France , Army , 636638 Armee de lArmistice , 638Armee Metropolitaine mobilization , 636 CASE YELLOW fall gelb , 636 casualty W orld W ar , 636 communication , 636 defense Dakar , 638 deficiency manpower , 636 de Gaulle , Charles , 636 , 637 de Tassigny , Lattre , 637 image dilemma France military planner , 636 division leger e de cavalerie , 637638 DLMs , 637 draft , 636 Gamelin , Maurice , 636 Geor ge , Alphonse , 636 imperial force , 638 Maginot Line , 636 multiplicity headquarters , 636 rearmament program 1936 onward , 637 strange defeat , 636 typical infantry division , 637 Vers larmee du metier Army Future , 636 France , Battle May 10June 25 , 1940 , 638642 ceasefire agreement , 641 defeatism internal political struggle , 639 de Gaulle , Charles , 641 description , 639 , 641 Gamelin , Maurice , 639 German plan , 639 Giraud , Henri , 639 Guderian , Heinz , 639 Manstein , Erich von , 639 map German conquest France , 1940 , 640 Ptain , Henri Philippe , 641 Phony W ar , 638639 precipitate event , 638639 Schlief fen Plan , 639 strength force , 638 Touchon , Robert Auguste , 639 France , Navy , 642644 action Allies , 643 battleship , 642 cruiser force , 642 Free French , 643 French naval planning formula , 642 loss , 644 Norway Campaign , 643 photograph , 643 scuttle , 643as September 1939 , 642 sonarradar , 643 submarine , 642643 Vichy government control , 643 France Campaign 1944 , 644648 Argentan , 646 Bradley , Omar Nelson , 646 Canadian II Corps , 646 capture vranches , 644 definition , 644 description , 644 , 646647 German Seventh Army , 646 land Normandy , 644 major mistake , 646 map France , 1944 , 645 Operation COBRA , 646 OPERA TION DRAGOON , 647 outcome , 646647 photograph V ictory Parade , August 29 , 1944 , 646 saturation bombing , 644 Third Army , 646 VII Corps , 644 XV Corps , 646 France , V ichy  , 730731 Civil W ar , 731 country bordering , 730 effect W orld W ar II , 730 famine disease loss , 730 Greek People Liberation Army , 731 Hitler invasion , 730 island , 730 Italian invasion Albania , 730 Jewish community Holocaust , 731 location , 730Metaxas , Ioannis , 730 National Liberation Front , 731 National Republican Greek League , 731 Papandreou , Geor ge , 731 population 1939 , 730 resistance group , 731 Greece , Air Force , 731732 aircraft , 731 Albanian front , 731 control , 731 Greek governmentinexile , 731 replacement part , 731 size , 731 squadron , 731 Greece , Army , 732 19401941 campaign , 732 casualty count , 732 commander , 732 Italian invasion Albania , 732 motorize division , 732 Number division , 732 number men , 732 political infighting , 732 Royal Hellenic Army , 732 Third Mountain Brigade , 732 Greece , Navy , 732733 component , 732 eastern Mediterranean , 732 handicap , 732 integration British Royal Navy , 732 late 1939 , 732 mutiny , 732 Greece Campaign , German April 630 , 1941 , 733735 commander , 733 consequence , 735 description , 733734 evacuation , 735 First Greek Army , 733 , 734 Force W British , 733 German aircraft attack Greek port Piraeus , 734 German invasion Greece Bulgaria , 733734 Koryzis , Alexandros , 735 loss , 735 map Greece Crete , 19401941 , 734 number great prisoner , 734 Operation DEMON , 735 precipitate event , 733 purpose , 7332nd Panzer Division , 734 Second Greek Army , 733 Greece Campaign , Italian October 28 , 1940March 1941 , 735737 Battle Cape Matapan , 737 British Commonwealth advance , 737 British fensive North Africa , 737 casualty count , 737 Cavallero , Ugo , 736 consequence Italian failure , 736 description , 736737 Greek resistance , 736 Hitler , Adolf , , 736 Italian retreat , 737 Italian ultimatum , 736 Mussolini , Benito , 735 , 736 , 737 Papagos , Alexandros , 736 precipitate event , 735736 strength force , 736 ViscontiPrasca , Sebastiano , 736 Greer , attack September 4 , 1941 , 738 armament , 738 description , 738 Roosevelt , Franklin D Roosevelt , Radio Address , September 3 , 1939 , 2009201 1 doc  Roosevelt , Statement Finland , December 1 , 1939 , 2022 doc "
1939,"fight undoubtedly influence Stalin decision sign nonaggressio n pact Germany August 1939  Stalin decision sign nonaggressio n pact Germany August 1939 also give Tokyo new appreciation Soviet fight ability 1941 help influence Japanese leade r strike not north Siberia easy target Europe colony Southeast Asia  March 10 , 1939 , address Eighteenth Party Congress Soviet Union , Stalin say Soviet Union not intend pull anyone el chestnut fire  early May 1939 , Stalin give encouragement Hitler Hitler dismiss Commissar Foreign Affairs Maksim Foreign Affairs Maksim Litvinov appoint Vyacheslav Molotov Hitler place  Stalin insist treaty would forthcoming unless British officiallyrecognized Soviet Union sizable territorial acquisition make GermanSoviet NonAggression Pact August 23 , 1939 German invasion Soviet Union , begin June 22 , 1941  Finnish leader believe Stalin bluffing , contrive border incident November 26 , 1939 , Stalin order invasion , begin Nove mber 30 , 1939  Upset Western capitulation Munich , regard effort British French leader divert Hitler eastward , March 10 , 1939 , Stalin announce Soviet Union not intend pull anyone el chestnut fire  May 3 , 1939 , Stalin give encouragement Hitler Hitler replace Commissar Foreign Affairs Maxim M Stalin quickly act fall France cash remain chip pact August 1939 , annex Baltic state take Bessarabia northern Bukovina Romania  Unsentimental matter , August 1939 Stalin arrange nonaggression pact Germany allow Hitler invade Poland without fear war Soviets  Finnish leader reject Stalin demand territory Karelia , November 1939 Stalin order Soviet force invade Finland order secure territory base potential German attack  high commissioner Allied Council Austria , 937 Keyes , Roger John Brownlow 18721945 , 937938 appointment , 937 Boxer Uprising , 937 commander Dover Patrol , 938 commodore char ge submarine service , 937 Conservative member Parliament , 938 date place birth , 937 death , 938 director combine operation , 938 fall Prime Minister Neville Chamberlain , 938 liaison ficer King Leopold III Belgium , 938 peer , 938 promotion , 937 , 938 son , 938 Keynes , John Maynard , 712 Khalkhin Gol , Battle MaySeptember 1939 , 938939 casualty count , 939 command ficers , 938 consequence , 939 definition , 938 description , 938 outcome , 938939 precipitate event , 938 Khan , Noor Inayat , 1811 Kharkov , Battles 19411943 , 939941 casualty count , 940 command ficers , 939 , 940 Hitler , Adolf , , 940 Kharkov , importance , 939 Operation BARBAROSSA , 939 photograph , 940 Red Army Winter fensive , 939 Second Battle Kharkov , 939 significance , 940 Third Battle Kharkov , 939940 Kholm Pocket January 23 May 5 , 1942 , 941942 attempt relieve , 941 command ficers , 941description , 941 Hitler , Adolf , , 941 Kholm Shield award , 941 outcome , 941 significant Soviet attack , 941 Khozin , Mikhail Semenovich 18961979 , 942 Khrushchev , Nikita , 1630 Kiev Pocket , Battle August 21 September 26 , 1941 , 942943 commander , 942 consequence , 943 definition , 942 description , 943 precipitate event , 942 Stalin , Joseph , 943 Kikkawa Kiyoshi 19001943 , 943944 Battle Cape St"
